{
  "schema_version": "0.2.0",
  "doc_type": "record",
  "dataset": "ds002718",
  "bids_relpath": "sub-004/eeg/sub-004_task-FaceRecognition_eeg.set",
  "modality": "EEG",
  "datatype": "eeg",
  "suffix": "eeg",
  "file_extension": ".set",
  "data_name": "ds002718_sub-004_task-FaceRecognition_eeg.set",
  "entities": {
    "subject": "004",
    "session": null,
    "task": "FaceRecognition",
    "run": null,
    "acquisition": null,
    "space": null
  },
  "signal_properties": {
    "sampling_frequency": 250,
    "power_line_frequency": 50,
    "reference": "nose",
    "recording_type": "continuous",
    "channel_system": null,
    "placement_scheme": "extended 10-10% system"
  },
  "signal_summary": {
    "nchans": 74,
    "ntimes": 749000,
    "recording_duration": 2996,
    "channel_type_counts": {
      "EEG": 70,
      "HEOG": 1,
      "VEOG": 1,
      "ECG": 2
    }
  },
  "provenance": {
    "digested_at": null,
    "created_at": null,
    "modified_at": null
  },
  "extensions": {
    "rawDetail": {
      "channel_names": [
        "EEG001", "EEG002", "EEG003", "EEG004", "EEG005", "EEG006", "EEG007",
        "EEG008", "EEG009", "EEG010", "EEG011", "EEG012", "EEG013", "EEG014",
        "EEG015", "EEG016", "EEG017", "EEG018", "EEG019", "EEG020", "EEG021",
        "EEG022", "EEG023", "EEG024", "EEG025", "EEG026", "EEG027", "EEG028",
        "EEG029", "EEG030", "EEG031", "EEG032", "EEG033", "EEG034", "EEG035",
        "EEG036", "EEG037", "EEG038", "EEG039", "EEG040", "EEG041", "EEG042",
        "EEG043", "EEG044", "EEG045", "EEG046", "EEG047", "EEG048", "EEG049",
        "EEG050", "EEG051", "EEG052", "EEG053", "EEG054", "EEG055", "EEG056",
        "EEG057", "EEG058", "EEG059", "EEG060", "EEG061", "EEG062", "EEG063",
        "EEG064", "EEG065", "EEG066", "EEG067", "EEG068", "EEG069", "EEG070",
        "EEG071", "EEG072", "EEG073", "EEG074"
      ],
      "channel_types": [
        "EEG", "EEG", "EEG", "EEG", "EEG", "EEG", "EEG", "EEG", "EEG", "EEG",
        "EEG", "EEG", "EEG", "EEG", "EEG", "EEG", "EEG", "EEG", "EEG", "EEG",
        "EEG", "EEG", "EEG", "EEG", "EEG", "EEG", "EEG", "EEG", "EEG", "EEG",
        "EEG", "EEG", "EEG", "EEG", "EEG", "EEG", "EEG", "EEG", "EEG", "EEG",
        "EEG", "EEG", "EEG", "EEG", "EEG", "EEG", "EEG", "EEG", "EEG", "EEG",
        "EEG", "EEG", "EEG", "EEG", "EEG", "EEG", "EEG", "EEG", "EEG", "EEG",
        "HEOG", "VEOG", "ECG", "ECG", "EEG", "EEG", "EEG", "EEG", "EEG", "EEG",
        "EEG", "EEG", "EEG", "EEG"
      ],
      "eeg_json": {
        "TaskName": "FaceRecognition",
        "TaskDescription": "Subjects viewed stimuli on a screen during six, 7.5 minute runs.",
        "InstitutionAddress": "15 Chaucer Road, Cambridge, UK",
        "InstitutionName": "MRC Cognition & Brain Sciences Unit",
        "EEGReference": "nose",
        "EEGGround": "left collar bone",
        "SamplingFrequency": 250,
        "PowerLineFrequency": 50,
        "SoftwareFilters": {
          "LowPassFilter": { "cutoff": "350 (Hz)" }
        },
        "EEGPlacementScheme": "extended 10-10% system",
        "CapManufacturer": "Easycap",
        "EEGChannelCount": 70,
        "EOGChannelCount": 2,
        "RecordingType": "continuous",
        "MiscChannelCount": 4,
        "RecordingDuration": 2996,
        "ECGChannelCount": 0,
        "EMGChannelCount": 0
      },
      "participant_tsv": {
        "age": null,
        "gender": null
      },
      "bids_dependencies": [
        "ds002718/dataset_description.json",
        "ds002718/participants.tsv",
        "ds002718/sub-004/eeg/sub-004_task-FaceRecognition_events.tsv",
        "ds002718/task-FaceRecognition_events.json",
        "ds002718/sub-004/eeg/sub-004_task-FaceRecognition_eeg.json",
        "ds002718/sub-004/eeg/sub-004_task-FaceRecognition_electrodes.tsv",
        "ds002718/sub-004/eeg/sub-004_task-FaceRecognition_channels.tsv",
        "ds002718/sub-004/eeg/sub-004_task-FaceRecognition_coordsystem.json"
      ],
      "electrode_tsv": null,
      "events_tsv": null
    }
  }
}
