{
  "schema_version": "0.2.0",
  "doc_type": "record",
  "dataset": "ds005514",
  "bids_relpath": "sub-NDARAC589YMB/eeg/sub-NDARAC589YMB_task-DespicableMe_eeg.set",
  "modality": "EEG",
  "datatype": "eeg",
  "suffix": "eeg",
  "file_extension": ".set",
  "data_name": "ds005514_sub-NDARAC589YMB_task-DespicableMe_eeg.set",
  "entities": {
    "subject": "NDARAC589YMB",
    "session": null,
    "task": "DespicableMe",
    "run": null,
    "acquisition": null,
    "space": null
  },
  "signal_properties": {
    "sampling_frequency": 500,
    "power_line_frequency": 60,
    "reference": "Cz",
    "recording_type": "continuous",
    "channel_system": "GSN-HydroCel-129",
    "placement_scheme": null
  },
  "signal_summary": {
    "nchans": 129,
    "ntimes": 134967,
    "recording_duration": 269.934,
    "channel_type_counts": {
      "EEG": 129
    }
  },
  "provenance": {
    "digested_at": null,
    "created_at": null,
    "modified_at": null
  },
  "extensions": {
    "rawDetail": {
      "channel_names": [
        "E1", "E2", "E3", "E4", "E5", "E6", "E7", "E8", "E9", "E10",
        "E11", "E12", "E13", "E14", "E15", "E16", "E17", "E18", "E19", "E20",
        "E21", "E22", "E23", "E24", "E25", "E26", "E27", "E28", "E29", "E30",
        "E31", "E32", "E33", "E34", "E35", "E36", "E37", "E38", "E39", "E40",
        "E41", "E42", "E43", "E44", "E45", "E46", "E47", "E48", "E49", "E50",
        "E51", "E52", "E53", "E54", "E55", "E56", "E57", "E58", "E59", "E60",
        "E61", "E62", "E63", "E64", "E65", "E66", "E67", "E68", "E69", "E70",
        "E71", "E72", "E73", "E74", "E75", "E76", "E77", "E78", "E79", "E80",
        "E81", "E82", "E83", "E84", "E85", "E86", "E87", "E88", "E89", "E90",
        "E91", "E92", "E93", "E94", "E95", "E96", "E97", "E98", "E99", "E100",
        "E101", "E102", "E103", "E104", "E105", "E106", "E107", "E108", "E109",
        "E110", "E111", "E112", "E113", "E114", "E115", "E116", "E117", "E118",
        "E119", "E120", "E121", "E122", "E123", "E124", "E125", "E126", "E127",
        "E128", "Cz"
      ],
      "channel_types": [
        "EEG", "EEG", "EEG", "EEG", "EEG", "EEG", "EEG", "EEG", "EEG", "EEG",
        "EEG", "EEG", "EEG", "EEG", "EEG", "EEG", "EEG", "EEG", "EEG", "EEG",
        "EEG", "EEG", "EEG", "EEG", "EEG", "EEG", "EEG", "EEG", "EEG", "EEG",
        "EEG", "EEG", "EEG", "EEG", "EEG", "EEG", "EEG", "EEG", "EEG", "EEG",
        "EEG", "EEG", "EEG", "EEG", "EEG", "EEG", "EEG", "EEG", "EEG", "EEG",
        "EEG", "EEG", "EEG", "EEG", "EEG", "EEG", "EEG", "EEG", "EEG", "EEG",
        "EEG", "EEG", "EEG", "EEG", "EEG", "EEG", "EEG", "EEG", "EEG", "EEG",
        "EEG", "EEG", "EEG", "EEG", "EEG", "EEG", "EEG", "EEG", "EEG", "EEG",
        "EEG", "EEG", "EEG", "EEG", "EEG", "EEG", "EEG", "EEG", "EEG", "EEG",
        "EEG", "EEG", "EEG", "EEG", "EEG", "EEG", "EEG", "EEG", "EEG", "EEG",
        "EEG", "EEG", "EEG", "EEG", "EEG", "EEG", "EEG", "EEG", "EEG", "EEG",
        "EEG", "EEG", "EEG", "EEG", "EEG", "EEG", "EEG", "EEG", "EEG", "EEG",
        "EEG", "EEG", "EEG", "EEG", "EEG", "EEG", "EEG", "EEG", "EEG"
      ],
      "eeg_json": {
        "TaskName": "surroundSupp",
        "SamplingFrequency": 500,
        "PowerLineFrequency": 60,
        "EEGReference": "Cz",
        "RecordingType": "continuous",
        "SoftwareFilters": "n/a",
        "InstitutionName": "Child Mind Institute",
        "InstitutionAddress": "101 E 56th St, New York, NY 10022",
        "Manufacturer": "Magtism EGI",
        "ManufacturersModelName": "128-channel GSN 200 v.2.1",
        "EEGChannelCount": 129,
        "RecordingDuration": 269.934
      },
      "participant_tsv": {
        "release_number": "R9",
        "sex": "M",
        "age": 14.5916,
        "ehq_total": 93.38,
        "commercial_use": "Yes",
        "full_pheno": "No",
        "p_factor": -0.684,
        "attention": -0.383,
        "internalizing": -1.299,
        "externalizing": -0.078
      },
      "bids_dependencies": [
        "ds005514/dataset_description.json",
        "ds005514/participants.tsv",
        "ds005514/sub-NDARAC589YMB/eeg/sub-NDARAC589YMB_task-DespicableMe_eeg.json",
        "ds005514/sub-NDARAC589YMB/eeg/sub-NDARAC589YMB_task-DespicableMe_events.tsv",
        "ds005514/sub-NDARAC589YMB/eeg/sub-NDARAC589YMB_task-DespicableMe_channels.tsv",
        "ds005514/task-DespicableMe_eeg.json",
        "ds005514/task-DespicableMe_events.json"
      ],
      "electrode_tsv": null,
      "events_tsv": null
    }
  }
}
